02:30|“Oh, Daddy,” I said. Blubbering now. “He’s not dead. At least he wasn’t at <b>two-thirty</b> this morning. We’ve got to dig him up. We have to, because we buried him alive.”|If It Bleeds|Stephen King
02:30|She looked at her watch: <b>half past two</b>. A few minutes to calm down before she had to go.|The Locked Room|Maj Sjöwall & Per Wahlöö
02:30|"I'm in mufti myself: white gloves and matching tennis shoes. But I'm sorry to report that Jo is still in her Dr. Dentons. What're you wearing, Shirl? <br/> ""My old drum majorette's outfit. The one I wore to the State Finals. Listen, we can't tie up the phones like this.""<br/> ""Why not?"" said Harry. ""Who's going to call at <b>2:30 a.m.</b> with a better idea? Yippee, to quote Lew, we're having a party! What're we serving, Lew?""<br/> ""Beer, I guess. Haven't got any wine, have we, Jo?""<br/> ""Just for cooking."""|The Night People|Jack Finney
02:30|At about <b>half past two</b> she had been woken by the creak of footsteps out on the stairs. At first she had been frightened.|The Little Stranger|Sarah Waters
02:30|Inc, I tried to pull her off about <b>0230</b>, and there was this fucking… sound.|Infinite Jest|David Foster Wallace
02:30|It is <b>2.30 am</b> and I am tight. As a tick, as a lord, as a newt. Must write this down before the sublime memories fade and blur.|Any Human Heart|William Boyd
