11:45|It was <b>eleven forty-five</b> but my cousin still wasn’t back. It was getting close to lunchtime and the cafeteria was starting to get more crowded. All sorts of sounds and voices mixed together like smoke enveloping the room. I returned once more to the realm of memory. And that small gold pen she had in her breast pocket.|Blind Willow, Sleeping Woman|Haruki Murakami
11:45|<b>11:45 AM</b> - 06/05/2014<br>More details have emerged in the investigation into the killings at Val-de-Grâce early Wednesday morning.|The Catacombs|Jeremy Bates
11:45|I waited till a <b>quarter to twelve</b>, and found then that I was in All Souls'. But I wasn't much frightened, for I thought it could be tomorrow as well.|Far From the Maddening Crowd|Thomas Hardy
11:45|I will tell you the time, said Septimus, very slowly, very drowsily, smiling mysteriously. As he sat smiling at the dead man in the grey suit the quarter struck, the <b>quarter to twelve</b>.|Mrs. Dalloway|Virginia Woolf
11:45|I arrived at St. Gatien from Nice on Tuesday, the 14th of August. I was arrested at <b>11.45 am</b> on Thursday, the 16th by an agent de police and an inspector in plain clothes and taken to the Commissariat.|Epitaph for a Spy|Eric Ambler
11:45|His mother straightened the battered alarm clock that was lying on its side in the middle of the mantelpiece until its dial showed a <b>quarter to twelve </b>and then laid it once more on its side.|A Portrait of the Artist as a Young Man|James Joyce
