12:45|12:45 P.M.|On Friday at 12:45 P.M., David arrived at the Athenaeum, a massive white building on the corner of Pall Mall, overlooked by a statue of the Duke of York.|Not a Penny More, Not a Penny Less|Jeffrey Archer
12:45|a quarter to one|That Sunday was a picture-book summer day in Maine: clear, bright, warm. At a quarter to one, Ruth McCausland, dressed in a pretty blue summer frock, left her house for the last time.|The Tommyknockers|Stephen King
12:45|12:45|"The boy handed in a dispatch. The Professor closed the door again, and after looking at the direction, opened it and read aloud. ""Look out for D. He has just now, 12:45, come from Carfax hurriedly and hastened towards the South. He seems to be going the round and may want to see you: Mina"""|Dracula|Bram Stoker
12:45|quarter to one|Because it was raining, and because she was depressed and out of sorts, and because Robbie had not come by quarter to one, Elizabeth treated herself to a Martini while she was waiting, sitting uncomfortably on a narrow chair in the restaurant, watching other unimpressive people go in and out.|The Lottery, or the Adventure of James Harris|Shirley Jackson
12:45|quarter to one o'clock|By this time it was a quarter to one o'clock, but Karl Ivanitch never thought of releasing us, He merely set us a new lesson to learn.|Childhood|Leo Tolstoy
12:45|quarter to one|"Good, he reflected. ""It is now a quarter to one."|Vladimir Nabokov|King, queen, knave
